{
  "arrival": {
    "active_users": 2,
    "kind": "closed_loop"
  },
  "scenario_id": "llama-cpp-cpu-protocol-qualification-v1",
  "schema_version": "0.1",
  "session": {
    "think_time_ms": 0
  },
  "source": {
    "kind": "local_jsonl",
    "path": "workload.jsonl"
  },
  "workload_classes": [
    {
      "id": "substantive-short-answer",
      "weight": 1.0
    }
  ]
}
